{
  "schemaVersion": 1,
  "configurationVersion": "2026-27-calendar-12",
  "updatedAt": "2026-09-29T23:21:04Z",
  "timeZoneIdentifier": "America/New_York",
  "bellOffsetSeconds": -13,
  "metadata": {
    "status": "2026-2027-production-calendar",
    "notes": "Bell patterns and Black/Gold assignments are confirmed for 2026-2027. Beta Black and Beta Gold test days run August 17-21, 2026. Orientation Day on August 31, 2026 begins at 8:00 AM. June dates may change based on emergency-day usage. August 30, 2027 is a provisional Orientation Day for end-of-calendar continuity."
  },
  "dateAssignments": [
    {
      "date": "2026-08-17",
      "dayType": "beta-black-day"
    },
    {
      "date": "2026-08-18",
      "dayType": "beta-gold-day"
    },
    {
      "date": "2026-08-19",
      "dayType": "beta-black-day"
    },
    {
      "date": "2026-08-20",
      "dayType": "beta-gold-day"
    },
    {
      "date": "2026-08-21",
      "dayType": "beta-black-day"
    },
    {
      "date": "2026-08-25",
      "dayType": "teacher-workshop"
    },
    {
      "date": "2026-08-26",
      "dayType": "teacher-workshop"
    },
    {
      "date": "2026-08-27",
      "dayType": "teacher-workshop"
    },
    {
      "date": "2026-08-31",
      "dayType": "orientation-day"
    },
    {
      "date": "2026-09-01",
      "dayType": "gold-day"
    },
    {
      "date": "2026-09-02",
      "dayType": "black-day"
    },
    {
      "date": "2026-09-03",
      "dayType": "gold-day"
    },
    {
      "date": "2026-09-04",
      "dayType": "black-day"
    },
    {
      "date": "2026-09-07",
      "dayType": "holiday"
    },
    {
      "date": "2026-09-08",
      "dayType": "gold-day"
    },
    {
      "date": "2026-09-09",
      "dayType": "black-day"
    },
    {
      "date": "2026-09-10",
      "dayType": "gold-day"
    },
    {
      "date": "2026-09-11",
      "dayType": "black-day"
    },
    {
      "date": "2026-09-14",
      "dayType": "gold-day"
    },
    {
      "date": "2026-09-15",
      "dayType": "black-day"
    },
    {
      "date": "2026-09-16",
      "dayType": "gold-day"
    },
    {
      "date": "2026-09-17",
      "dayType": "black-day"
    },
    {
      "date": "2026-09-18",
      "dayType": "gold-day"
    },
    {
      "date": "2026-09-21",
      "dayType": "black-day"
    },
    {
      "date": "2026-09-22",
      "dayType": "gold-day"
    },
    {
      "date": "2026-09-23",
      "dayType": "black-day"
    },
    {
      "date": "2026-09-24",
      "dayType": "gold-day"
    },
    {
      "date": "2026-09-25",
      "dayType": "black-day"
    },
    {
      "date": "2026-09-28",
      "dayType": "gold-day"
    },
    {
      "date": "2026-09-29",
      "dayType": "black-day"
    },
    {
      "date": "2026-09-30",
      "dayType": "early-release"
    },
    {
      "date": "2026-10-01",
      "dayType": "black-day"
    },
    {
      "date": "2026-10-02",
      "dayType": "afternoon-assembly"
    },
    {
      "date": "2026-10-05",
      "dayType": "black-day"
    },
    {
      "date": "2026-10-06",
      "dayType": "gold-day"
    },
    {
      "date": "2026-10-07",
      "dayType": "black-day"
    },
    {
      "date": "2026-10-08",
      "dayType": "gold-day"
    },
    {
      "date": "2026-10-09",
      "dayType": "teacher-workshop"
    },
    {
      "date": "2026-10-12",
      "dayType": "holiday"
    },
    {
      "date": "2026-10-13",
      "dayType": "black-day"
    },
    {
      "date": "2026-10-14",
      "dayType": "gold-day"
    },
    {
      "date": "2026-10-15",
      "dayType": "black-day"
    },
    {
      "date": "2026-10-16",
      "dayType": "gold-day"
    },
    {
      "date": "2026-10-19",
      "dayType": "black-day"
    },
    {
      "date": "2026-10-20",
      "dayType": "gold-day"
    },
    {
      "date": "2026-10-21",
      "dayType": "black-day"
    },
    {
      "date": "2026-10-22",
      "dayType": "gold-day"
    },
    {
      "date": "2026-10-23",
      "dayType": "black-day"
    },
    {
      "date": "2026-10-26",
      "dayType": "gold-day"
    },
    {
      "date": "2026-10-27",
      "dayType": "black-day"
    },
    {
      "date": "2026-10-28",
      "dayType": "early-release"
    },
    {
      "date": "2026-10-29",
      "dayType": "black-day"
    },
    {
      "date": "2026-10-30",
      "dayType": "gold-day"
    },
    {
      "date": "2026-11-02",
      "dayType": "black-day"
    },
    {
      "date": "2026-11-03",
      "dayType": "gold-day"
    },
    {
      "date": "2026-11-04",
      "dayType": "black-day"
    },
    {
      "date": "2026-11-05",
      "dayType": "gold-day"
    },
    {
      "date": "2026-11-06",
      "dayType": "black-day"
    },
    {
      "date": "2026-11-09",
      "dayType": "gold-day"
    },
    {
      "date": "2026-11-10",
      "dayType": "black-day"
    },
    {
      "date": "2026-11-11",
      "dayType": "holiday"
    },
    {
      "date": "2026-11-12",
      "dayType": "gold-day"
    },
    {
      "date": "2026-11-13",
      "dayType": "black-day"
    },
    {
      "date": "2026-11-16",
      "dayType": "gold-day"
    },
    {
      "date": "2026-11-17",
      "dayType": "black-day"
    },
    {
      "date": "2026-11-18",
      "dayType": "gold-day"
    },
    {
      "date": "2026-11-19",
      "dayType": "black-day"
    },
    {
      "date": "2026-11-20",
      "dayType": "gold-day"
    },
    {
      "date": "2026-11-23",
      "dayType": "black-day"
    },
    {
      "date": "2026-11-24",
      "dayType": "gold-day"
    },
    {
      "date": "2026-11-25",
      "dayType": "staff-in-service-comp-day"
    },
    {
      "date": "2026-11-26",
      "dayType": "holiday"
    },
    {
      "date": "2026-11-27",
      "dayType": "vacation"
    },
    {
      "date": "2026-11-30",
      "dayType": "black-day"
    },
    {
      "date": "2026-12-01",
      "dayType": "gold-day"
    },
    {
      "date": "2026-12-02",
      "dayType": "black-day"
    },
    {
      "date": "2026-12-03",
      "dayType": "gold-day"
    },
    {
      "date": "2026-12-04",
      "dayType": "black-day"
    },
    {
      "date": "2026-12-07",
      "dayType": "gold-day"
    },
    {
      "date": "2026-12-08",
      "dayType": "black-day"
    },
    {
      "date": "2026-12-09",
      "dayType": "early-release"
    },
    {
      "date": "2026-12-10",
      "dayType": "black-day"
    },
    {
      "date": "2026-12-11",
      "dayType": "gold-day"
    },
    {
      "date": "2026-12-14",
      "dayType": "black-day"
    },
    {
      "date": "2026-12-15",
      "dayType": "gold-day"
    },
    {
      "date": "2026-12-16",
      "dayType": "black-day"
    },
    {
      "date": "2026-12-17",
      "dayType": "gold-day"
    },
    {
      "date": "2026-12-18",
      "dayType": "black-day"
    },
    {
      "date": "2026-12-21",
      "dayType": "gold-day"
    },
    {
      "date": "2026-12-22",
      "dayType": "early-release"
    },
    {
      "date": "2026-12-23",
      "dayType": "vacation"
    },
    {
      "date": "2026-12-24",
      "dayType": "vacation"
    },
    {
      "date": "2026-12-25",
      "dayType": "holiday"
    },
    {
      "date": "2026-12-28",
      "dayType": "vacation"
    },
    {
      "date": "2026-12-29",
      "dayType": "vacation"
    },
    {
      "date": "2026-12-30",
      "dayType": "vacation"
    },
    {
      "date": "2026-12-31",
      "dayType": "vacation"
    },
    {
      "date": "2027-01-01",
      "dayType": "holiday"
    },
    {
      "date": "2027-01-04",
      "dayType": "gold-day"
    },
    {
      "date": "2027-01-05",
      "dayType": "black-day"
    },
    {
      "date": "2027-01-06",
      "dayType": "gold-day"
    },
    {
      "date": "2027-01-07",
      "dayType": "black-day"
    },
    {
      "date": "2027-01-08",
      "dayType": "gold-day"
    },
    {
      "date": "2027-01-11",
      "dayType": "black-day"
    },
    {
      "date": "2027-01-12",
      "dayType": "gold-day"
    },
    {
      "date": "2027-01-13",
      "dayType": "black-day"
    },
    {
      "date": "2027-01-14",
      "dayType": "gold-day"
    },
    {
      "date": "2027-01-15",
      "dayType": "black-day"
    },
    {
      "date": "2027-01-18",
      "dayType": "holiday"
    },
    {
      "date": "2027-01-19",
      "dayType": "gold-day"
    },
    {
      "date": "2027-01-20",
      "dayType": "black-day"
    },
    {
      "date": "2027-01-21",
      "dayType": "gold-day"
    },
    {
      "date": "2027-01-22",
      "dayType": "black-day"
    },
    {
      "date": "2027-01-25",
      "dayType": "gold-day"
    },
    {
      "date": "2027-01-26",
      "dayType": "black-day"
    },
    {
      "date": "2027-01-27",
      "dayType": "early-release"
    },
    {
      "date": "2027-01-28",
      "dayType": "black-day"
    },
    {
      "date": "2027-01-29",
      "dayType": "gold-day"
    },
    {
      "date": "2027-02-01",
      "dayType": "black-day"
    },
    {
      "date": "2027-02-02",
      "dayType": "gold-day"
    },
    {
      "date": "2027-02-03",
      "dayType": "black-day"
    },
    {
      "date": "2027-02-04",
      "dayType": "gold-day"
    },
    {
      "date": "2027-02-05",
      "dayType": "black-day"
    },
    {
      "date": "2027-02-08",
      "dayType": "gold-day"
    },
    {
      "date": "2027-02-09",
      "dayType": "black-day"
    },
    {
      "date": "2027-02-10",
      "dayType": "gold-day"
    },
    {
      "date": "2027-02-11",
      "dayType": "black-day"
    },
    {
      "date": "2027-02-12",
      "dayType": "gold-day"
    },
    {
      "date": "2027-02-15",
      "dayType": "holiday"
    },
    {
      "date": "2027-02-16",
      "dayType": "vacation"
    },
    {
      "date": "2027-02-17",
      "dayType": "vacation"
    },
    {
      "date": "2027-02-18",
      "dayType": "vacation"
    },
    {
      "date": "2027-02-19",
      "dayType": "vacation"
    },
    {
      "date": "2027-02-22",